{
  "environment": "development",
  "debug": true,
  "server": {
    "host": "0.0.0.0",
    "port": 8000,
    "cors_origins": ["*"],
    "request_timeout": 30,
    "max_upload_size_mb": 50
  },
  "logging": {
    "level": "DEBUG",
    "format": "detailed",
    "file_logging": false,
    "console_logging": true
  },
  "security": {
    "rate_limit_per_minute": 120,
    "cors_strict": false,
    "csrf_protection": false,
    "secure_cookies": false
  },
  "performance": {
    "enable_caching": true,
    "cache_ttl": 300,
    "enable_compression": false,
    "worker_processes": 1
  },
  "features": {
    "enable_ai_features": true,
    "enable_experimental_ui": true,
    "enable_performance_monitoring": true,
    "enable_hot_reload": true
  },
  "mcp": {
    "health_check_interval": 15,
    "max_retry_attempts": 5,
    "timeout_seconds": 10,
    "auto_restart": true
  },
  "monitoring": {
    "enable_metrics": true,
    "metrics_endpoint": "/metrics",
    "health_check_endpoint": "/health",
    "detailed_errors": true
  }
}