{
  "environment": "production",
  "debug": false,
  "server": {
    "host": "0.0.0.0",
    "port": 8000,
    "cors_origins": [],
    "request_timeout": 30,
    "max_upload_size_mb": 10
  },
  "logging": {
    "level": "INFO",
    "format": "json",
    "file_logging": true,
    "console_logging": false,
    "log_file": "/var/log/wkolibrary/app.log"
  },
  "security": {
    "rate_limit_per_minute": 60,
    "cors_strict": true,
    "csrf_protection": true,
    "secure_cookies": true,
    "force_https": true
  },
  "performance": {
    "enable_caching": true,
    "cache_ttl": 3600,
    "enable_compression": true,
    "worker_processes": "auto"
  },
  "features": {
    "enable_ai_features": true,
    "enable_experimental_ui": false,
    "enable_performance_monitoring": true,
    "enable_hot_reload": false
  },
  "mcp": {
    "health_check_interval": 30,
    "max_retry_attempts": 3,
    "timeout_seconds": 5,
    "auto_restart": true
  },
  "monitoring": {
    "enable_metrics": true,
    "metrics_endpoint": "/metrics",
    "health_check_endpoint": "/health",
    "detailed_errors": false
  }
}
